nazwa_obiektu;region;kategoria_obiektu;adres;maps_url;lokalizacja
Sierż. phm. Tadeusz Milewski ps. Ćwik (1920–1944) – członek Organizacji Małego Sabotażu „Wawer” oraz Grup Szturmowych warszawskich Szarych Szeregów, uczestnik wielu akcji bojowych, m.in. akcji „TU” (Tłuszcz-Urle) i akcji „Par I”, uczestnik powstania warszawskiego w harcerskim batalionie AK „Zośka”, kawaler Krzyża Walecznych, brat Kazimierza Milewskiego „Janki”.;C. Szefowie Głównej Kwatery „Pasieki”;;;NOT_FOUND;
Andrzej Włodzimierz Miller ps. Pantera (1930–2004) – członek Szarych Szeregów Chorągwi Warszawskiej Ul „Wisła”, żołnierz Armii Krajowej Grupy Bojowej „Krybar”, łącznik i listonosz Oddziału Powiśle Harcerskiej Poczty Polowej przy ul. Okólnik 1, uczestnik powstania warszawskiego.;C. Szefowie Głównej Kwatery „Pasieki”;;Pałac Gnińskich, Okólnik 1, 00-368 Warszawa, Polska;https://www.google.com/maps/place/?q=place_id:ChIJ55JQuVjMHkcRQ9lOmpA3eB4;52.2364854,21.022957
Strz. Tadeusz Miller ps. Tygrys (1928) – członek „Zawiszaków” warszawskich Szarych Szeregów, harcerz 9 Warszawskiej Drużyny Harcerzy im. gen. Józefa Sowińskiego – Hufca Wola Rój „Giewont” Bloku „Reduta”, uczestnik powstania warszawskiego w harcerskim batalionie AK „Wigry”.;C. Szefowie Głównej Kwatery „Pasieki”;;;NOT_FOUND;
Por. hm. inż. Stefan Mirowski ps. Bolek, Bolesław Radlewicz, Nosowicz II, Prawdzic, Łukasz, Bek, Kuguar, Rokita (1920–1996) – komendant Hufca „Mokotów Górny” (MG) Chorągwi Warszawskiej Szarych Szeregów „Ul Wisła” i Obwodu Mokotów Górny Organizacji Małego Sabotażu „Wawer”, jeden ze współautorów programu ideowego Szarych Szeregów – „Dziś, jutro, pojutrze”, komendant Okręgu Południe Ula „Wisła” i komendant Okręgu Południe w Organizacji Małego Sabotażu „Wawer”, organizator pierwszych drużyn „Zawiszy” – najmłodszego pionu Szarych Szeregów na Mokotowie i pierwszy komendant „Zawiszy”, kierownik Wydziału Zawiszy w Głównej Kwaterze Szarych Szeregów „Pasiece”, komendant Chorągwi Warszawskiej Szarych Szeregów Ul „Wisła” (1943–1944), komendant Bloku „Prochownia” (Ochota), członek Głównej Kwatery Szarych Szeregów „Pasieki” w Krakowie (1944–1945), po II wojnie światowej inżynier mechanik, pracownik Ministerstwa Przemysłu i Handlu, później Państwowej Komisji Planowania Gospodarczego oraz Polskiego Komitetu Normalizacji, Miar i Jakości, główny specjalista w Centralnym Ośrodku Informacji Normalizacyjnej i Metrologicznej, zastępca komendanta Chorągwi Warszawskiej ZHP i członek Komendy Hufca ZHP Śródmieście (1945–1948), sekretarz Komisji Weryfikacyjnej przy Naczelnej Radzie Harcerskiej (1957–1958), jeden z sygnatariuszy listu do władz państwowych w obronie ZHP, znanego jako list „Bandy Czworga” (1989), przewodniczący ZHP (1990–1996), kawaler Krzyża Srebrnego Orderu Virtuti Militari i Krzyża Walecznych, pośmiertnie odznaczony Krzyżem Komandorskim Orderu Odrodzenia Polski (1996), brat Tadeusza Mirowskiego „Oracza”.;C. Szefowie Głównej Kwatery „Pasieki”;;;NOT_FOUND;
Sierż. pchor. phm. Tadeusz Mirowski ps. Oracz (1919–1943) – członek Akademickiego Kręgu Starszoharcerskiego „Kuźnica”, autor oraz realizator programów wiedzy o Polsce w szkolnictwie zawodowym, współredaktor pisma „Bądź gotów”, żołnierz harcerskiego batalionu AK „Zośka”, organizator szkoleń wojskowych w Bojowych Szkołach (BS) Chorągwi Warszawskiej Szarych Szeregów Ul „Wisła”, instruktor „Wiarusa”, szef pionu motoryzacji warszawskich Grup Szturmowych Szarych Szeregów, kierownik komórki Grup Szturmowych do spraw pogrzebowych, po akcji pod Arsenałem konwojował rannego Tadeusza Krzyżewicza „Buzdygana”, zginął podczas przygotowań do akcji bojowej pod Czarnocinem, kawaler Krzyża Walecznych, jeden z bohaterów książki Aleksandra Kamińskiego Kamienie na szaniec (1943), brat Stefana Mirowskiego „Bolka”, „Radlewicza”.;C. Szefowie Głównej Kwatery „Pasieki”;;;NOT_FOUND;
Hm. mgr Tadeusz Marek Mitera ps. Walerian Mironiak (1905–1986) – hufcowy Hufca Harcerzy Kraków Podgórze (1931–1939), komisarz Pogotowia Wojennego Harcerzy oraz organizator pomocniczej służby wojskowej (1939), członek Komendy Chorągwi Krakowskiej Szarych Szeregów Ul „Smok” oraz komendant Podgórskiego Roju Szarych Szeregów (1939–1941), żołnierz Batalionów Chłopskich, organizator tajnego nauczania, po II wojnie światowej nauczyciel w Państwowym Gimnazjum i Liceum im. Stanisława Staszica w Chrzanowie, członek Zarządu Powiatowego PCK i opiekun szkolnego koła PCK, komendant Hufca Harcerzy Chrzanów (1945–1947).;C. Szefowie Głównej Kwatery „Pasieki”;;Rynek Podgórski 2, 30-533 Kraków, Polska;https://www.google.com/maps/place/?q=place_id:ChIJz_yZ1UJbFkcR2goDfMoMmx0;50.04456709999999,19.9499244
Kpr. hm. prof. dr hab. Marian Młynarski ps. Zuikis, Kiškis (1926) – harcerz 21 Warszawskiej Drużyny Harcerzy im. gen. Ignacego Prądzyńskiego w Hufcu Ochota, członek Szarych Szeregów, drużynowy VI Drużyny „Zawiszy” Hufca Kraków Rój „Smok” Chorągwi Krakowskiej Szarych Szeregów Ul „Smok”, po II wojnie światowej instruktor harcerski, drużynowy 20 Krakowskiej Motorowej Drużyny Harcerzy, hufcowy Hufca Harcerzy Krowodrza-Łobzów oraz Hufca Kraków-Zwierzyniec, członek Komisji Historycznej Chorągwi Krakowskiej ZHP, muzealnik, herpetolog, pracownik Muzeum Przyrodniczego PAN (1942–1986), pracownik naukowy (1951–1986) i zastępca dyrektora Instytut Systematyki i Ewolucji Zwierząt Polskiej Akademii Nauk (1965–1972), założyciel Sekcji Herpetologicznej w Polskim Towarzystwie Zoologicznym, prezes Światowego Towarzystwa Herpetologicznego (1983), autor wielu publikacji naukowych, m.in. atlasu zoologicznego Płazy i gady Polski (1987) oraz wspomnień: Moja służba w „Zawiszy” (1998) i Moja harcerska służba (2013).;C. Szefowie Głównej Kwatery „Pasieki”;;;NOT_FOUND;
Ppor. phm. Witold Morawski ps. Witold Czarny (1919–1989) – członek tajnej organizacji samokształceniowej PET („Przyszłość”) i Grup Szturmowych warszawskich Szarych Szeregów Hufca „Południe” (PD), uczestnik wielu akcji bojowych, m.in. akcji „Gołąb”, akcji „Taśma” w Sieczychach koło Wyszkowa (trzecia grupy „Atak II”) i akcji „Wilanów” (zastępca dowódcy grupy „Streifa”) oraz akcji „Par I”, uczestnik powstania warszawskiego, szef wyszkolenia i ostatni dowódca 2. kompanii „Rudy” w harcerskim batalionie AK „Zośka”, kawaler Krzyża Srebrnego Orderu Virtuti Militari i Krzyża Walecznych (dwukrotnie).;C. Szefowie Głównej Kwatery „Pasieki”;;;NOT_FOUND;
Ppor. phm. Wojciech Morbitzer ps. Cis (1923–1944) – żołnierz batalionu AK „Zośka”, uczestnik wielu akcji bojowych Grup Szturmowych Szarych Szeregów, m.in. akcji „Jula” pod Tryńczą, uczestnik powstania warszawskiego (tuż przed wybuchem powstania odpowiedzialny za transport broni z magazynu przy ul. Obserwatorów na miejsce koncentracji w fabryce „Telefunken” na Woli), kawaler Krzyża Srebrnego Orderu Virtuti Militari i Krzyża Walecznych.;C. Szefowie Głównej Kwatery „Pasieki”;;;NOT_FOUND;
Hm. Stanisław Ludwik Mościcki ps. Biały Lis, Andrzej-Eligiusz, Ludwik, Zakliczewski (1903–1967) – komendant Mazowieckiej Chorągwi Harcerzy (1929–1932), od 1929 r. związany z ruchem zuchowym, jeden z najbliższych współpracowników Aleksandra Kamińskiego, kierownik Wydziału Zuchów Głównej Kwatery Harcerzy (1933–1935, 1937–1939) komendant Chorągwi Mazowieckiej Szarych Szeregów Ul „Puszcza” (1941–1942), po II wojnie światowej zastępca Naczelnika Harcerzy i szef Głównej Kwatery Harcerzy (1946–1947), zastępca hufcowego Hufca Staromiejskiego w Warszawie.;C. Szefowie Głównej Kwatery „Pasieki”;;;NOT_FOUND;
Ppor. phm. Bernard Mroziński ps. Mrozik, Prus, Zimny (1913–1993) – komendant Hufca Szarych Szeregów Rój „Spichrze” w Bydgoszczy, komendant Chorągwi Pomorskiej Szarych Szeregów Ul „Lina” (1942–1943), po II wojnie światowej specjalista w dziedzinie optyki, założyciel i właściciel zakładu optycznego w Bydgoszczy.;C. Szefowie Głównej Kwatery „Pasieki”;;;NOT_FOUND;
Hm. inż. Wincenty Mucha, ps. Komar, Żmudziński, Ponury, Spytek, Żubr (1910–1978) – komendant Samodzielnego Hufca Harcerzy (1937–1939) i komisarz Pogotowia Wojennego Harcerzy w Mościcach (1939), komendant Chorągwi Krakowskiej Szarych Szeregów Ul „Dzwon” (1944–1945), po II wojnie światowej komendant Hufca Harcerek i Harcerzy w Brzegu (1945–1948).;C. Szefowie Głównej Kwatery „Pasieki”;;;NOT_FOUND;
Ppor. hm. mgr Władysław Muż vel Wiktor Mikorowicz ps. Wilk Brat (1906–1959) – członek Tajnej Organizacji Wojskowej „Związek Orła Białego” (1939), członek zrzeszenia starszoharcerskiego „Wilcza Gromada” (1922–1939), komendant Krakowskiej Chorągwi Harcerzy (1934–1936), członek Komendy Chorągwi Krakowskiej Szarych Szeregów Ul „Smok” (1939–1940), jeden z najbliższych współpracowników komendanta hm. Seweryna Udzieli, organizator Szarych Szeregów w Hufcu Mielec Rój „Mleko” (1940–1941), po II wojnie światowej chemik, dyrektor Wytwórni Surowic i Szczepionek w Krakowie.;C. Szefowie Głównej Kwatery „Pasieki”;;;NOT_FOUND;
Sierż. Tadeusz Adam Müller ps. Zawrat (1925–1944) – członek Grup Szturmowych warszawskich Szarych Szeregów, uczestnik wielu akcji małego sabotażu i akcji „N” oraz akcji „Par II”, żołnierz harcerskiego batalionu AK „Zośka”, uczestnik powstania warszawskiego, kawaler Krzyża Walecznych.;C. Szefowie Głównej Kwatery „Pasieki”;;;NOT_FOUND;
Ppor. Jan Myszkowski-Bagiński ps. Bajan (1917–2010) – członek Grup Szturmowych Szarych Szeregów Hufca „Wola” (WL) Chorągwi Warszawskiej Szarych Szeregów „Ul Wisła”, uczestnik wielu akcji bojowych, m.in. akcji „Taśma” w Sieczychach koło Wyszkowa (grupa „Ubezpieczenie II”) oraz akcji „Wilanów” (grupa „Posterunek II”), a także akcji „Par II”, żołnierz harcerskiego batalionu AK „Zośka”, uczestnik powstania warszawskiego, po II wojnie światowej zamieszkał w Konstancinie-Jeziornie, pracownik Polskiej Akademii Nauk (1947–1982), członek Polskiego Związku Krótkofalowców (znany pod znakiem SP5JB), kawaler Krzyża Walecznych.;C. Szefowie Głównej Kwatery „Pasieki”;;;NOT_FOUND;
Hm. Bernard Myśliwek ps. Konrad, Emil Krenz (1909–1942) – pilot Pomorskiej Chorągwi Harcerzy (1934–1939), hufcowy Hufca Szarych Szeregów w Chojnicach i komendant Chorągwi Pomorskiej Szarych Szeregów Ul „Lina” (1940–1942), współorganizator Szarych Szeregów w Gdańsku (1941) oraz Hufca Szarych Szeregów w Gdyni (1941/1942) i harcerskiej kompanii kadrowej w 1942 r. przekształconej w Morski Batalion Szarych Szeregów, doprowadził do podporządkowania Szarym Szeregom Tajnego Hufca Harcerzy w Gdyni, uczestnik rozmów scaleniowych z Tajną Organizacją Wojskową „Gryf Pomorski”, organizator wywiadu Armii Krajowej na Pomorzu Gdańskim.;C. Szefowie Głównej Kwatery „Pasieki”;;;NOT_FOUND;
St. sierż. Czesław Nantel ps. Kolka (1921–1944) – członek Szarych Szeregów, żołnierz harcerskiego batalionu AK „Zośka”, uczestnik akcji dywersyjnej „TU” (Tłuszcz-Urle) w grupie II „Minerzy”, uczestnik powstania warszawskiego, kawaler Krzyża Walecznych (dwukrotnie).;C. Szefowie Głównej Kwatery „Pasieki”;;;NOT_FOUND;
Kpr. Jan Nastkiewicz ps. Kotwica (1920–1944) – członek tajnej organizacji samokształceniowej PET („Przyszłość”) oraz Grup Szturmowych warszawskich Szarych Szeregów Hufca „Centrum” (CR), żołnierz oddziału specjalnego Kedywu KG AK „Agat” i harcerskiego batalionu AK „Parasol”, w ramach akcji „Koppe” brał udział w transporcie broni z Warszawy do Krakowa, uczestnik powstania warszawskiego.;C. Szefowie Głównej Kwatery „Pasieki”;;;NOT_FOUND;
Phm. Ryszard Nieborak ps. Płomyk (1915–1944) – zastępca komendanta Chorągwi Wielkopolskiej Szarych Szeregów Ul „Przemysław” (1941–1943) i komendant miejski Szarych Szeregów w Poznaniu (1941–1944), kierował specjalną kolejową grupą Szarych Szeregów zajmującą się w latach 1942–1944 sabotażem w Poznaniu.;C. Szefowie Głównej Kwatery „Pasieki”;;Wilków Morskich 23/25, 60-480 Poznań, Polska;https://www.google.com/maps/place/?q=place_id:ChIJ945n-jZbBEcRIXR70PE9C0w;52.473202,16.7732551
Hm. mgr Wojciech Niederliński ps. Romanowski, Józef (1908–1999) – hufcowy Hufca Harcerzy w Świętochłowicach (1926–1927), kierownik Wydziału Starszego Harcerstwa Komendy Śląskiej Chorągwi Harcerzy (1936–1939), komendant Śląskiej Chorągwi Szarych Szeregów Ul „Huta” (1942–1945), po II wojnie światowej komendant Śląsko-Dąbrowskiej Chorągwi Harcerzy (1945–1949), komendant Śląsko-Dąbrowskiej Chorągwi Harcerstwa (1949), inicjator powołania (1962), kierownik (1978–1985) i honorowy przewodniczący (1985–1999) Komisji Historycznej Chorągwi Katowickiej ZHP, działacz turystyczny, członek Zarządu Głównego PTTK.;C. Szefowie Głównej Kwatery „Pasieki”;;;NOT_FOUND;
Mgr Jan Niedziela ps. Lis (1927–2013) – harcerz I Drużyny Bojowych Szkół Szarych Szeregów im. gen. Władysława Sikorskiego Chorągwi Lubelskiej Ul „Zboże”, uczestnik wielu akcji małego sabotażu, m.in. akcji zniszczenia niemieckiej kawiarni „Pod Strzechą” w Ogrodzie Saskim oraz akcji wywieszenia polskiej flagi na Bramie Trynitarskiej w Lublinie, a także akcji napisowych na murach, po II wojnie światowej uczestnik tzw. drugiej konspiracji harcerskiej (antysowieckiej), lekarz weterynarii, pracownik Państwowej Inspekcji Handlowej (1951–1988), prezes Lubelskiego Oddziału Stowarzyszenia Szarych Szeregów (1998–2002).;C. Szefowie Głównej Kwatery „Pasieki”;;;NOT_FOUND;
Kpt. hm. dr Antoni Michał Leon Nowak-Przygodzki ps. Aha, Jerzy, Opel, Zosik (1897–1959) – p.o. naczelnego komendanta skautowego (1919–1920), radny Rady Miejskiej Lwowa (1927–1939), adwokat, wykładowca w Wyższej Szkole Handlu Zagranicznego we Lwowie (1927–1939), przewodniczący Związku Obrońców Lwowa, uczestnik kampanii wrześniowej 1939 r., członek Komendy Harcerskiej Organizacji Niepodległościowej podporządkowanej w 1939 r. Naczelnictwu Szarych Szeregów w Warszawie, żołnierz Związku Walki Zbrojnej (ZWZ) i Armii Krajowej (AK), instruktor Inspektoratu Południowo-Wschodniego i oficer oświatowy Grup Szturmowych Szarych Szeregów, szef Biura Informacji i Propagandy (BIP) Komendy Warszawskiego Okręgu AK, kierownik Wojskowej Służby Społecznej (WSS) i Harcerskiej Poczty Polowej, uczestnik powstania warszawskiego, po II wojnie światowej na emigracji, zastępca ds. społecznych dowódcy Polskiego Okręgu Wojskowego Schleswig-Holstein, członek Komendy Głównej ZHP w Niemczech (1945–1947), wiceprzewodniczący Komitetu Wykonawczego Zjednoczenia Polskiego Uchodźstwa Wojennego, prezes Zarządu Głównego (1947–1948) i członek Rady Głównej Stowarzyszenia Kombatantów Polskich w Londynie (1948–1950), członek III Rady Narodowej Rzeczypospolitej Polskiej (1949–1951), członek Głównego Sądu ZHP we Francji, wykładowca w Szkole Nauk Politycznych i Społecznych w Paryżu, nauczyciel w Liceum Polskim w Les Ageux we Francji, kierownik Sekcji Polskiej Uniwersytetu Wolnej Europy w Strasburgu, członek Académie Internationale Libra de Sciences et des Lettres (1951), członek Towarzystwa Historyczno-Literackiego w Paryżu (1952), kawaler Krzyża Walecznych, odznaczony Krzyżem Niepodległości (1933).;C. Szefowie Głównej Kwatery „Pasieki”;;;NOT_FOUND;
"Ppor. hm. Edward Nowak ps. Jodła (1906–1991) – komendant Hufca Mysłowice (1932–1934) i Hufca w Niwce (1936–1939), komendant Pogotowia Wojennego Harcerzy w Niwce (1939), zastępca komendanta (1939–1941) i komendant Chorągwi Zagłębiowskiej Szarych Szeregów Ul „Barbara” (1941–1943), dowódca kompanii rezerwowej Oddziału Rozpoznawczego „Surowiec” 23 Dywizji Piechoty AK, po II wojnie światowej członek Komisji Historycznej Hufca Mysłowice i wiceprzewodniczący Komisji Historycznej Chorągwi Śląskiej ZHP w Katowicach; autor wierszy opublikowanych w trzech tomikach poezji: Poezja w służbie harcerstwa (1986), Wybór wierszy (1998) oraz Harcerskim piórem (2010).";C. Szefowie Głównej Kwatery „Pasieki”;;;NOT_FOUND;
Hm. Jerzy Nowakowski ps. Brzózka (1908–1979) – komendant Samodzielnego Hufca Piotrkowskiego Szarych Szeregów Rój „Sosnówka” podległego bezpośrednio Głównej Kwaterze „Pasiece” (1939–1940).;C. Szefowie Głównej Kwatery „Pasieki”;;;NOT_FOUND;
Stanisław Szymon Nowakowski ps. Stik, Murzyn (1922–1982) – członek Grup Szturmowych warszawskich Szarych Szeregów Hufca „Południe” (PD), uczestnik wielu akcji bojowych, m.in. akcji pod Celestynowem i akcji „Taśma” w Sieczychach koło Wyszkowa (druga grupa „Atak II”) oraz akcji „Wilanów”, żołnierz harcerskiego batalionu AK „Zośka”.;C. Szefowie Głównej Kwatery „Pasieki”;;;NOT_FOUND;
Ppor. Stanisław Nowiński ps. Niesz (1909–1988) – żołnierz oddziału specjalnego Kedywu KG AK „Pegaz” i harcerskiego batalionu AK „Parasol”, instruktor terenoznawstwa i wyszkolenia strzeleckiego w Szkole Podchorążych Rezerwy Piechoty „Agricola”, uczestnik wielu akcji bojowych, m.in. akcji bojowo-represyjnej „Wilanów” (dowódca grupy „Ubezpieczenie I”), uczestnik powstania warszawskiego.;C. Szefowie Głównej Kwatery „Pasieki”;;;NOT_FOUND;
Kpr. Jan Nowocień ps. Poręba (1923–1944) – członek Grup Szturmowych warszawskich Szarych Szeregów Hufca „Wola” (WL), żołnierz harcerskiego batalionu AK „Zośka”, uczestnik powstania warszawskiego, brat Józefa Nowocienia „Konrada”.;C. Szefowie Głównej Kwatery „Pasieki”;;Batalionu AK „Zośka”, Warszawa, Polska;https://www.google.com/maps/place/?q=place_id:ChIJmVnJk2zLHkcRE3MbEo5LSiA;52.23449799999999,20.9442145
Ppor. Józef Nowocień ps. Konrad (1920–2004) – członek Grup Szturmowych warszawskich Szarych Szeregów, uczestnik wielu akcji bojowych, m.in. akcji likwidacyjnej „Bürkl” (kierowca samochodu) i akcji bojowo-represyjnej „Wilanów” (grupa dowódcy), żołnierz harcerskiego batalionu AK „Zośka”, uczestnik powstania warszawskiego, po II wojnie światowej aktywny członek Środowiska Żołnierzy Batalionu AK „Zośka”, kawaler Krzyża Srebrnego Orderu Virtuti Militari i Krzyża Walecznych (dwukrotnie), brat Jana Nowocienia „Poręby”.;C. Szefowie Głównej Kwatery „Pasieki”;;;NOT_FOUND;
Ppor. Jerzy Wojciech Ochrymowicz ps. Dżems (1920–1969) – członek Szarych Szeregów, żołnierz harcerskiego batalionu AK „Zośka”, uczestnik akcji dywersyjnej „TU” (Tłuszcz-Urle) jako dowódca grupy III „Atak”, po II wojnie światowej lekarz.;C. Szefowie Głównej Kwatery „Pasieki”;;;NOT_FOUND;
Por. phm. Konrad Okolski ps. Kuba (1923–1944) – członek Grup Szturmowych warszawskich Szarych Szeregów Hufca „Centrum” (CR), uczestnik wielu akcji bojowych, m.in. akcji pod Arsenałem (grupa „Ubezpieczenie”, dowódca sekcji „Sygnalizacja”), pod Celestynowem i pod Pogorzelą (dowódca akcji) oraz akcji „Taśma” w Sieczychach koło Wyszkowa (zastępca dowódcy grupy „Atak I”) i akcji „Wilanów” (grupa „Posterunek I”), a także akcji „Góral” i jako zastępca komendanta bazy szkoleniowej w akcji „Par II”, uczestnik powstania warszawskiego w harcerskim batalionie AK „Zośka”, kawaler Krzyża Srebrnego Orderu Virtuti Militari i Krzyża Walecznych (dwukrotnie).;C. Szefowie Głównej Kwatery „Pasieki”;;Stare Nalewki 2/50, 00-242 Warszawa, Polska;https://www.google.com/maps/place/?q=place_id:ChIJh4jHzc3NHkcRI-jdW7Gif-Y;52.24568799999999,21.0019368
"Phm. Stanisław Okoń ps. Sumak, Okulicz (1918–1942) – komendant Chorągwi Krakowskiej Szarych Szeregów Ul „Smok” (1941–1942); okres jego komendantury charakteryzowało nasilenie akcji propagandowych, tzw. małego sabotażu i akcji „N” oraz rozwój szkolenia wojskowego starszych harcerzy.";C. Szefowie Głównej Kwatery „Pasieki”;;;NOT_FOUND;
Ppor. hm. Antoni Robert Olbromski ps. Prawdzic, dr Krauze, Sołtys (1896–1958) – współtwórca ruchu Kół Harcerzy z Czasów Walk o Niepodległość, członek Naczelnej Rady Harcerskiej (1921–1939), komendant Łódzkiej Chorągwi Harcerzy (1924–1927), wiceprzewodniczący ZHP (1929–1931), naczelnik harcerzy (1931–1936), sekretarz generalny Naczelnictwa ZHP (1939–1945), przedstawiciel Naczelnictwa ZHP w Komendzie Głównej Armii Krajowej (1943–1945), po II wojnie światowej organizator sądownictwa powszechnego i apelacyjnego na Ziemiach Odzyskanych, prezes Sądu Apelacyjnego we Wrocławiu, prezes Oddziału Wrocławskiego Zrzeszenia Prawników Demokratów i przewodniczący Komisji Popularyzacji Prawa we Wrocławiu, członek Zarządu Głównego Związku Pracowników Sądowych i Prokuratorskich RP, przewodniczący Zarządu Oddziału Dolnośląskiego ZHP (1946–1949), w 1954 r. przeniesiony do Biura Notarialnego w Łodzi.;C. Szefowie Głównej Kwatery „Pasieki”;;;NOT_FOUND;
Kpr. Żelisław Olech ps. Rawicz (1915–2005) – członek Grup Szturmowych warszawskich Szarych Szeregów Hufca „Południe” (PD), uczestnik wielu akcji bojowych, m.in. akcji pod Arsenałem (grupa „Ubezpieczenie”, sekcja „Stare Miasto”) i akcji „Wilanów” (grupa „Streifa”) oraz jako zastępca dowódcy akcji likwidacyjnej „Kretschmann”, żołnierz oddziału specjalnego Kedywu KG AK „Agat”, uczestnik powstania warszawskiego w harcerskim batalionie AK „Parasol”, z którym przeszedł cały szlak bojowy batalionu.;C. Szefowie Głównej Kwatery „Pasieki”;;;NOT_FOUND;
Ppor. hm. Władysław Erazm Olędzki ps. Papa, Astronom (1892–1944) – drużynowy I Drużyny Junackiej im. ks. Józefa Poniatowskiego w Warszawie i komendant Okręgu Lubelskiego „Junactwa” (1916), nauczyciel wychowania fizycznego (1916–1937), naczelnik Wydziału Wychowania Fizycznego w Kuratorium Okręgu Szkolnego m.st. Warszawy (1937–1939), członek Polskiej Organizacji Wojskowej (POW), drużynowy 23 Warszawskiej Drużyny Harcerskiej „Pomarańczarnia” im. Bolesława Chrobrego (1932–1937), uczestnik tajnego nauczania zorganizowanego przez Gimnazjum i Liceum im. Stefana Batorego dla Grup Szturmowych Szarych Szeregów w Warszawie, komendant Mazowieckiej Chorągwi Harcerzy (1933–1939), organizator i pierwszy komendant Wileńskiej Chorągwi Szarych Szeregów Ul „Brama”, kierownik Zespołu Wizytatorów tzw. „Polski Centralnej” obejmującej chorągwie: warszawską (Ul „Wisła”), mazowiecką (Ul „Puszcza”), radomską (Ul „Rady”) i lubelską (Ul „Zboże”) w Głównej Kwaterze Szarych Szeregów „Pasiece” (1943–1944), uczestnik powstania warszawskiego, jeden z głównych organizatorów i zastępca naczelnika oraz kierownik Oddziału Śródmieście Południe Harcerskiej Poczty Polowej przy ul. Wilczej 41, p.o. komendanta Chorągwi Warszawskiej Szarych Szeregów Ul „Wisła” (1944).;C. Szefowie Głównej Kwatery „Pasieki”;;Nowolipie 8, 00-150 Warszawa, Polska;https://www.google.com/maps/place/?q=place_id:ChIJ7UD-P3zMHkcRyuss-g4oPic;52.24453459999999,20.9952926
"Pchor. phm. Edward Olszyński ps. Zorian, Miriam (1923–1943) – członek I i II Komendy „Zawiszy"" w Głównej Kwaterze Szarych Szeregów „Pasiece”, komendant Hufca Zawiszy Rój „Stalowa Wola"" Chorągwi Warszawskiej Szarych Szeregów Ul „Wisła”, uczestnik wielu akcji małego sabotażu.";C. Szefowie Głównej Kwatery „Pasieki”;;;NOT_FOUND;
Sierż. Wojciech Omyła ps. Wojtek (1924–1944) – członek Szarych Szeregów, uczestnik powstania warszawskiego w harcerskim batalionie AK „Zośka”, kawaler Krzyża Walecznych.;C. Szefowie Głównej Kwatery „Pasieki”;;Szarych Szeregów, Warszawa, Polska;https://www.google.com/maps/place/?q=place_id:ChIJfaVIcJ7MHkcR1RBKytdMvp4;52.2271722,20.9729467
Ppor. hm. dr Jerzy Ossowski ps. Wojciech, Wujek (1911–1944) – wizytator Głównej Kwatery Szarych Szeregów „Pasieki” dla Chorągwi Lubelskiej Ul „Zboże” i Chorągwi Radomskiej Ul „Rady”, członek Rady Wychowawczej Grup Szturmowych Szarych Szeregów (1944) kierowanej przez prof. Józefa Zawadzkiego, uczestnik powstania warszawskiego.;C. Szefowie Głównej Kwatery „Pasieki”;;;NOT_FOUND;
