nazwa_obiektu;region;kategoria_obiektu;adres;maps_url;lokalizacja
Por. phm. mgr Marian Szymański ps. Wędzidło (1923–2013) – członek Pogotowia Wojennego Harcerzy, Polskiej Organizacji Skautowej (POS) i Grup Szturmowych (GS) Szarych Szeregów Hufca Łowicz Rój „Łoza”, uczestnik licznych akcji małego sabotażu oraz akcji zdobywania broni, jeden z inicjatorów i uczestników akcji „Uwolnić «Cyfrę»” (I zastępca dowódcy akcji), żołnierz Armii Krajowej, po II wojnie nauczyciel wychowania fizycznego w I Liceum Ogólnokształcącym im. Feliksa Fabianiego w Radomsku (1957–1991) i trener lekkoatletyki w MKS Radomsko, członek Zarządu Oddziału Stowarzyszenia Szarych Szeregów w Łowiczu i Sądu Koleżeńskiego, autor opracowań: Sport w Łowiczu w okresie okupacji niemieckiej 1939-1945 oraz Akcja „M” łowickich Szarych Szeregów 1942-1945.;C. Szefowie Głównej Kwatery „Pasieki”;;;NOT_FOUND;
Ppłk hm. prof. dr Wiktor Szyryński vel Victor Szyrynski (1913–2007) – starszy asystent na Uniwersytecie Stefana Batorego w Wilnie, zastępca komendanta Wileńskiej Chorągwi Szarych Szeregów Ul „Brama” (1939–1940), specjalista neuropsycholog w 6 batalionie sanitarnym 6 Lwowskiej Dywizji Piechoty, kierownik Wydziału Programowego Komendy ZHP na Wschodzie (1943–1944) i wizytator wychowania harcerskiego na Afrykę przy Delegaturze (Kuratorium) Ministerstwa Oświaty (1945), po II wojnie światowej na emigracji w Kanadzie, delegat Naczelnictwa ZHP poza granicami Kraju na Kanadę (1948–1958), ordynator w Szpitalu Wojskowym Lotnictwa Kanadyjskiego w Ottawie, prezes Amerykańskiej Akademii Medycyny Psychosomatycznej (1965–1966), członek Kongresu Polonii Kanadyjskiej, członek-założyciel Kanadyjskiego Towarzystwa Psychiatrycznego, członek zwyczajny Towarzystwa Badań Naukowych Sigma Xi, członek Polskiego Towarzystwa Naukowego na Obczyźnie, profesor psychologii Polskiego Uniwersytetu na Obczyźnie w Londynie, autor książek Wycieczki harcerskie (1936) oraz Ambulans harcerski (1937), odznaczony Krzyżem Komandorskim Orderu Odrodzenia Polski (1989).;C. Szefowie Głównej Kwatery „Pasieki”;;;NOT_FOUND;
Ppor. Zygmunt Śluzek ps. Sigma (1923–1944) – członek Szarych Szeregów, żołnierz harcerskiego batalionu AK „Zośka”, uczestnik akcji dywersyjnej „TU” (Tłuszcz-Urle) w grupie II „Minerzy”, uczestnik powstania warszawskiego, kawaler Krzyża Walecznych (dwukrotnie).;C. Szefowie Głównej Kwatery „Pasieki”;;;NOT_FOUND;
Phm. Józef Śmigaj (1915–1989) – członek Akademickiego Koła Harcerskiego im. Heliodora Święcickiego w Poznaniu (1935–1938), kolporter prasy podziemnej, komendant miejski Szarych Szeregów w Poznaniu (1939−1941), organizator tajnego nauczania w Nałęczowie (1941–1944), żołnierz Armii Krajowej, po II wojnie światowej prawnik, pracownik Wydziału Cywilnego Sądu Wojewódzkiego w Poznaniu, asystent w Katedrze Teorii Państwa i Prawa Uniwersytetu Poznańskiego.;C. Szefowie Głównej Kwatery „Pasieki”;;;NOT_FOUND;
Por. hm. Manswet Śmigielski ps. Szwed, Jan (1900–1944) – kierownik, nauczyciel i wychowawca Publicznej Szkoły Powszechnej im. Polskiej Organizacji Wojskowej w Zielonej-Grzybowej (1937–1944), organizator tajnego nauczania i współtwórca Szarych Szeregów w powiecie warszawskim, komendant Chorągwi Mazowieckiej Szarych Szeregów Ul „Puszcza” (1942–1944), uczestnik powstania warszawskiego w batalionie AK „Zośka”, kawaler Krzyża Srebrnego Orderu Virtuti Militari i Krzyża Walecznych.;C. Szefowie Głównej Kwatery „Pasieki”;;;NOT_FOUND;
Por. inż. Wojciech Zygmunt Świątkowski ps. Korczak (1922) – członek Tajnej Armii Polskiej (TAP) oraz „Zawiszaków” warszawskich Szarych Szeregów, harcerz 16 Warszawskiej Drużyny Harcerzy im. Zawiszy Czarnego Hufca Ochota Rój „Sulima” Bloku „Prochownia” Chorągwi Warszawskiej Szarych Szeregów Ul „Wisła”, uczestnik akcji dywersyjnej pod Płochocinem oraz akcji likwidacyjnej „Koppe” (grupa ubezpieczająca), żołnierz oddziału specjalnego Kedywu KG AK „Pegaz”, szef służby „Moto” harcerskiego batalionów AK „Parasol”, uczestnik powstania warszawskiego w składzie Zgrupowania AK „Radosław”, po II wojnie światowej architekt, wykładowca w Policealnym Studium Architektoniczno-Budowlanym im. Stanisława Noakowskiego w Warszawie (1965–1990), współzałożyciel pierwszej w Polsce spółdzielni prywatnych pracowni architektonicznych APA w Warszawie, członek Kapituły Nagrody im. Jana Rodowicza „Anody” ustanowionej w 2011 r. przez Muzeum Powstania Warszawskiego, kawaler Krzyża Srebrnego Orderu Virtuti Militari.;C. Szefowie Głównej Kwatery „Pasieki”;;;NOT_FOUND;
Plut. Jerzy Antoni Świderski ps. Pol (1927–1944) – członek Organizacji Małego Sabotażu „Wawer” oraz Bojowych Szkół (BS) Chorągwi Warszawskiej Szarych Szeregów Ul „Wisła”, uczestnik powstania warszawskiego w harcerskim batalionie AK „Zośka”, kawaler Krzyża Walecznych, cioteczny brat Wiesława Krajewskiego „Sema”, „Mikiego”.;C. Szefowie Głównej Kwatery „Pasieki”;;Batalionu AK „Zośka”, Warszawa, Polska;https://www.google.com/maps/place/?q=place_id:ChIJmVnJk2zLHkcRE3MbEo5LSiA;52.23449799999999,20.9442145
Phm. Jacek Tabęcki ps. Czubek (1921–1942) – członek Polskiej Ludowej Akcji Niepodległościowej (PLAN), uczestnik akcji małego sabotażu i kolporter prasy podziemnej, członek Organizacji Małego Sabotażu „Wawer” oraz Grup Szturmowych warszawskich Szarych Szeregów Hufca „Mokotów Górny” (MG), zginął w obozie koncentracyjnym w Oświęcimiu.;C. Szefowie Głównej Kwatery „Pasieki”;;;NOT_FOUND;
Plut. pchor. phm. Jerzy Tabor ps. Pająk (1924–1943) – członek warszawskich Grup Szturmowych Szarych Szeregów, organizator i wykonawca akcji megafonowej oraz uczestnik wielu akcji bojowych, m.in. akcji pod Arsenałem (grupa „Ubezpieczenie”, sekcja „Getto”), kawaler Krzyża Walecznych.;C. Szefowie Głównej Kwatery „Pasieki”;;;NOT_FOUND;
Plut. Hubert Taczanowski ps. Hubert (1924–1944) – członek warszawskich Grup Szturmowych Szarych Szeregów Hufca „Południe” (PD), uczestnik wielu akcji bojowych, m.in. akcji „Taśma” w Sieczychach koło Wyszkowa (grupa „Ubezpieczenie I”), żołnierz harcerskiego batalionu AK „Zośka”, uczestnik powstania warszawskiego, kawaler Krzyża Walecznych.;C. Szefowie Głównej Kwatery „Pasieki”;;;NOT_FOUND;
Hm. Władysław Talaga ps. Beduin (1908–1986) – drużynowy III Drużyny Harcerzy im. ks. Józefa Poniatowskiego w Jarocinie (1936–1939), organizator konspiracyjnego harcerstwa w Mielcu, komendant Roju „Mleko” (Mielec) Chorągwi Krakowskiej Szarych Szeregów Ul „Smok”, organizator akcji pomocy dla jeńców radzieckich i francuskich oraz Żydów, po II wojnie światowej pracował w księgowości, organizator harcerstwa w Głogowie.;C. Szefowie Głównej Kwatery „Pasieki”;;;NOT_FOUND;
Phm. Jerzy Teodorczyk ps. Gryf, Igor (1910–1997) – komendant Chorągwi Częstochowskiej Szarych Szeregów Ul „Warta” (1944–1945), dyrektor Fabryki Cykorii w Kłomnicach.;C. Szefowie Głównej Kwatery „Pasieki”;;;NOT_FOUND;
Hm. Kazimierz Tomiłło (1916-1983) – zastępca komendanta (1940-1941) i komendant Chorągwi Lubelskiej Szarych Szeregów Ul „Zboże” (1942), po II wojnie światowej zastępca komendanta Lubelskiej Chorągwi Harcerzy (1945-1946), kierownik Wydziału Drużyn Specjalnych Lubelskiej Chorągwi Harcerzy (1947-1948), skarbnik i kierownik Wydziału Organizacji Komendy Krakowskiej Chorągwi Harcerzy (1948-1949).;C. Szefowie Głównej Kwatery „Pasieki”;;;NOT_FOUND;
Hm. Zdzisław Trojanowski (1913–1941) – komendant Chorągwi Lwowskiej Szarych Szeregów Ul „Lew” (1940).;C. Szefowie Głównej Kwatery „Pasieki”;;;NOT_FOUND;
Kpr. pchor. phm. dr Mieczysław Alojzy Trząski ps. Pantera (1922–2019) – współtwórca Szarych Szeregów w Milanówku, komendant Zawiszy Hufca Milanówek Rój „Milion” Chorągwi Mazowieckiej Szarych Szeregów Ul „Puszcza”, organizator i drużynowy Zawiszy oraz Bojowych Szkół Szarych Szeregów w Żyrardowie, po II wojnie światowej drużynowy akademickiej drużyny instruktorskiej „Watra” na Uniwersytecie Jagiellońskim w Krakowie (1947–1948), kierownik laboratorium Centralnego Szpitala Klinicznego MSW w Warszawie, wiceprzewodniczący Środowiska „Mielizna” Obwodu „Bażant” Światowego Związku Żołnierzy Armii Krajowej.;C. Szefowie Głównej Kwatery „Pasieki”;;Szarych Szeregów, 05-822 Milanówek, Polska;https://www.google.com/maps/place/?q=place_id:ChIJgTTgMRZJGUcRDkFQexm75M8;52.1392463,20.6584452
Jerzy Tytus Trzciński ps. Tytus (1922–2006) – harcerz 23 Warszawskiej Drużyny Harcerskiej „Pomarańczarnia” im. Bolesława Chrobrego, członek Grup Szturmowych warszawskich Szarych Szeregów, uczestnik wielu akcji bojowych, m.in. akcji pod Arsenałem (grupa „Ubezpieczenie”, dowódca sekcji „Getto”), żołnierz harcerskiego batalionu AK „Zośka”, więzień obozów koncentracyjnych w Oświęcimiu i Buchenwaldzie, po II wojnie światowej na emigracji w Stanach Zjednoczonych, zamieszkał w Chicago.;C. Szefowie Głównej Kwatery „Pasieki”;;;NOT_FOUND;
Hm. mgr Tadeusz Władysław Twardosz ps. Dimon, Mały (1925–2004) – członek Szarych Szeregów w Roju „Smok” (Kraków) Chorągwi Krakowskiej Szarych Szeregów Ul „Smok”, po II wojnie światowej instruktor harcerski, kwatermistrz (1957), hufcowy (1958–1960) i zastępca hufcowego (1961–1963, 1967–1969) oraz instruktor Komendy Hufca ZHP Kraków-Zwierzyniec (1963–1964), przewodniczący Zarządu Okręgu Małopolskiego ZHP rok założenia 1918 (1990–1992) i Związku Harcerstwa Rzeczypospolitej (1992–1993), członek Stronnictwa Demokratycznego (SD).;C. Szefowie Głównej Kwatery „Pasieki”;;;NOT_FOUND;
"Ppor. Tadeusz Tyczyński ps. Pudel, Topora (1923–1944) – członek Grup Szturmowych warszawskich Szarych Szeregów Hufca „Centrum” (CR), żołnierz harcerskiego batalionu AK „Zośka”, instruktor terenoznawstwa, uczestnik wielu akcji bojowych, m.in. akcji dywersyjnych pod Celestynowem, pod Pogorzelą oraz pod Rogóżnem, a także akcji „Par II”, uczestnik powstania warszawskiego, kawaler Krzyża Walecznych; jeden ze zdobytych czołgów przy ul. Okopowej w Warszawie koledzy na jego cześć nazwali „Pudel”, stryjeczny brat Wiesława Tyczyńskiego „Olgierda”.";C. Szefowie Głównej Kwatery „Pasieki”;;Batalionu AK „Zośka”, Warszawa, Polska;https://www.google.com/maps/place/?q=place_id:ChIJmVnJk2zLHkcRE3MbEo5LSiA;52.23449799999999,20.9442145
"Ppor. phm. Wiesław Marian Tyczyński ps. Olgierd (1922–1944) – członek Grup Szturmowych warszawskich Szarych Szeregów Hufca „Centrum” (CR), żołnierz harcerskiego batalionu AK „Zośka”, uczestnik wielu akcji bojowych Grup Szturmowych Szarych Szeregów (1943–1944), m.in. akcji dywersyjnych pod Celestynowem i pod Pogorzelą, instruktor wyszkolenia bojowego w „Bazie leśnej” pod Wyszkowem (akcja „Par II”), uczestnik powstania warszawskiego, kawaler Krzyża Walecznych; w pamięci kolegów zachował się jako człowiek o nieprzeciętnej osobowości, stryjeczny brat Tadeusza Tyczyńskiego „Pudla”.";C. Szefowie Głównej Kwatery „Pasieki”;;Batalionu AK „Zośka”, Warszawa, Polska;https://www.google.com/maps/place/?q=place_id:ChIJmVnJk2zLHkcRE3MbEo5LSiA;52.23449799999999,20.9442145
Ppłk Eugeniusz Tyrajski ps. Genek, Sęk (1926–2019) – członek Organizacji Małego Sabotażu „Wawer” oraz Grup Szturmowych warszawskich Szarych Szeregów Hufca „Mokotów Górny” (MG), żołnierz batalionu „Karpaty” pułku AK „Baszta” (1943–1944), uczestnik powstania warszawskiego, po II wojnie światowej główny księgowy Oddziału Stołecznego PTTK (1956–1959) oraz główny księgowy i zastępca dyrektora Biura Urządzania Lasu i Geodezji Leśnej (1959-1990), wiceprzewodniczący (1990–2017) i przewodniczący Rady Fundacji „Warszawa Walczy 1939-1945” (2017–2019), skarbnik (2005–2014) i wiceprezes Zarządu Głównego Związku Powstańców Warszawskich (2014–2019), jeden z najbliższych współpracowników prezesa gen. bryg. Zbigniewa Ścibora-Rylskiego „Motyla”, odznaczony Krzyżem Komandorskim Orderu Odrodzenia Polski (2005).;C. Szefowie Głównej Kwatery „Pasieki”;;;NOT_FOUND;
Ppor. hm. Seweryn Jan Kazimierz Udziela ps. Jus, Lubicz, Kret, Stefan (1911–1941) – członek Akademickiego Kręgu Starszoharcerskiego „Watra” na Uniwersytecie Jagiellońskim w Krakowie (1928–1932), przewodniczący Komisji Dyscyplinarnej Śląskiej Chorągwi Harcerzy i członek korespondent Wydziału Zagranicznego Głównej Kwatery Harcerzy (1937–1938), naczelnik Sądu Grodzkiego w Jabłonkowie na Zaolziu (1938–1939), zastępca komendanta Krakowskiej Chorągwi Harcerzy (1939), komendant Chorągwi Krakowskiej Szarych Szeregów Ul „Smok” (1940–1941).;C. Szefowie Głównej Kwatery „Pasieki”;;;NOT_FOUND;
Kpr. pchor. Tadeusz Ulankiewicz ps. Warski (1922–1944) – członek „Zawiszaków” warszawskich Szarych Szeregów, harcerz 16 Warszawskiej Drużyny Harcerzy im. Zawiszy Czarnego Hufca Ochota Rój „Sulima” Bloku „Prochownia” Chorągwi Warszawskiej Szarych Szeregów Ul „Wisła”, dowódca plutonu batalionu szturmowego „Odwet” 4. Rejonu Obwodu V (Mokotów) Warszawskiego Okręgu AK, żołnierz harcerskiego batalionów AK „Parasol”, uczestnik akcji likwidacyjnej „Koppe” (zastępca dowódcy akcji).;C. Szefowie Głównej Kwatery „Pasieki”;;Piaskowa 4, 01-067 Warszawa, Polska;https://www.google.com/maps/place/?q=place_id:ChIJ-dYmXYXLHkcRO1Wpwq9sVlc;52.2547079,20.9775156
Ppor. phm. inż. Zbigniew Urych ps. Ryszard (1920–2000) – komendant Bojowych Szkół Szarych Szeregów w Lublinie (1943), komendant Chorągwi Lubelskiej Szarych Szeregów Ul „Zboże” (1944), po II wojnie światowej skarbnik Akademickiego Kręgu Harcerskiego „Wodnik” przy Politechnice Gdańskiej (1946–1948).;C. Szefowie Głównej Kwatery „Pasieki”;;Żołnierzy Niepodległej 7, 20-078 Lublin, Polska;https://www.google.com/maps/place/?q=place_id:ChIJn0gm22dXIkcRUNOCvKQtvj8;51.2490178,22.556258
Por. hm. inż. Bolesław Usow ps. Konar, Żar (1913–1954) – uczestnik kampanii wrześniowej 1939 r. w 36 Pułku Piechoty Legii Akademickiej w składzie 28 Dywizji Piechoty Armii „Łódź”, uczestnik obrony Warszawy, członek Szarych Szeregów Chorągwi Warszawskiej Ul „Wisła”, uczestnik historycznego zebrania naczelnictwa ZHP, podczas którego podjęto decyzję o przejściu harcerstwa do konspiracji i powołaniu Szarych Szeregów, współpracownik Głównej Kwatery „Pasieki” (1939–1941), dowódca oddziału partyzanckiego NOW-AK „Ojca Jana” (OP-44), uczestnik bitwy na Porytowym Wzgórzu w Lasach Janowskich w 1944 r. (największej bitwy partyzanckiej na ziemiach polskich), komendant Obwodu Jarosław Narodowego Zjednoczenia Wojskowego (NZW), po II wojnie światowej inżynier leśnik, nadleśniczy Nadleśnictwa Kwidzyn, kawaler Krzyża Srebrnego Orderu Virtuti Militari.;C. Szefowie Głównej Kwatery „Pasieki”;;;NOT_FOUND;
Ppor. hm. inż. Bogusław Stanisław Ustaborowicz ps. Żar (1922–2000) – członek Grup Szturmowych warszawskich Szarych Szeregów, żołnierz oddziału specjalnego Kedywu KG AK „Agat” i harcerskiego batalionu AK „Parasol”, uczestnik wielu akcji małego sabotażu oraz akcji likwidacyjnych: „Bürkl”, „Kretschmann”, „Weffels”, „Braun” i „Rodewald”, po II wojnie światowej Komendant Główny ZHP na terenie Niemiec (1951–1952), od 1952 r. na emigracji w Stanach Zjednoczonych, kierownik 21 Kręgu Starszoharcerskiego „Orłów Kresowych” im. Stanisława Sedlaczka w Chicago (Okręg ZHP Stany Zjednoczone), działacz polonijny, wyróżniony tytułem „Zasłużony dla Polonii Amerykańskiej”, kawaler Krzyża Srebrnego Orderu Virtuti Militari.;C. Szefowie Głównej Kwatery „Pasieki”;;;NOT_FOUND;
Mjr Władysław Wajnert ps. Władek, Tramwajarz (1921–2016) – członek Organizacji Małego Sabotażu „Wawer” oraz Grup Szturmowych warszawskich Szarych Szeregów, żołnierz harcerskich batalionów AK „Zośka” i „Parasol”, a także oddziału do zadań specjalnych Kedywu KG AK, uczestnik wielu akcji bojowych, m.in. akcji „Góral”, „Szymanów” i „Polowanie”, zastępca dowódcy akcji na aptekę Wendego przy ul. Krakowskie Przedmieście 55 w Warszawie, podczas której 10 lipca 1944 r. zdobyto narzędzia chirurgiczne, lekarstwa, środki znieczulające i materiały opatrunkowe dla sanitariatu Kedywu KG AK, uczestnik powstania warszawskiego w Zgrupowaniu „Żniwiarz” Obwodu II „Żywiciel” (Żoliborz) Warszawskiego Okręgu AK, po II wojnie światowej pracownik Związku Rewizyjnego Spółdzielni RP (1946–1952), kawaler Krzyża Srebrnego Orderu Virtuti Militari i Krzyża Walecznych (dwukrotnie).;C. Szefowie Głównej Kwatery „Pasieki”;;Batalionu AK „Zośka”, Warszawa, Polska;https://www.google.com/maps/place/?q=place_id:ChIJmVnJk2zLHkcRE3MbEo5LSiA;52.23449799999999,20.9442145
Mjr dr hab. n. med. Jerzy Waleszkowski ps. Ali, Ali Sadowy (1924–2014) – członek Tajnej Armii Polskiej (1940) i Grup Szturmowych warszawskich Szarych Szeregów Hufca „Południe” (PD), żołnierz oddziału specjalnego „Jerzy” Kedywu KG AK i harcerskiego batalionu AK „Zośka”, instruktor terenoznawstwa w Szkole Niższych Dowódców „Belweder”, uczestnik kilku akcji sabotażowych i dywersyjnych, m.in. akcji „Sól” na Targówku w Warszawie, uczestnik powstania warszawskiego, po II wojnie światowej wykładowca akademicki Akademii Medycznej w Łodzi, neurochirurg Uniwersyteckiego Szpitala Klinicznego im. Norberta Balickiego w Łodzi, autor wspomnień w Pamiętnikach żołnierzy baonu „Zośka”, kawaler Krzyża Walecznych.;C. Szefowie Głównej Kwatery „Pasieki”;;;NOT_FOUND;
Ks. mjr hm. dr Józef Warszawski vel Stanisław Kamiński ps. Ojciec Paweł (1903–1997) – uczestnik kampanii wrześniowej 1939 r., uczestnik powstania warszawskiego, kapelan harcerskich batalionów AK „Zośka” i „Parasol” oraz Zgrupowania „Radosław” Kedywu KG AK, redaktor Wojskowej Katolickiej Agencji Prasowej, po II wojnie światowej pracował w Niemczech (1945–1948), Anglii (1948–1950) i Watykanie (1950–1994), w 1994 r. powrócił do Warszawy, organizator Zrzeszenia Wydawców i Dziennikarzy Polskich w Niemczech, współzałożyciel Zjednoczenia Polskiego i redaktor „Biuletynu Informacyjnego”, profesor Papieskiego Uniwersytetu Gregoriańskiego, kierownik sekcji polskiej Radia Watykańskiego (1951–1957), kawaler Krzyża Srebrnego Orderu Virtuti Militari i Krzyża Walecznych, odznaczony Krzyżem Komandorskim Orderu Odrodzenia Polski (1963).;C. Szefowie Głównej Kwatery „Pasieki”;;;NOT_FOUND;
Por. hm. Kazimierz Seweryn Wasilewski ps. Kobza, Bachus (1901–1944) –wizytator Głównej Kwatery Szarych Szeregów „Pasieki” dla Polski Wschodniej (1941–1944), organizator komórki „N” w Chorągwi Białostockiej Szarych Szeregów Ul „Biały”, żołnierz Armii Krajowej, adiutant dowódcy V Zgrupowania AK „Siekiera” 2. Rejonu Obwodu I (Śródmieście) Warszawskiego Okręgu AK, uczestnik powstania warszawskiego, dowódca Zgrupowania AK „Kryska”.;C. Szefowie Głównej Kwatery „Pasieki”;;;NOT_FOUND;
Sierż. Kazimierz Wasiłowski ps. Korwin (1921–1944) – członek Grup Szturmowych warszawskich Szarych Szeregów Hufca „Południe” (PD), żołnierz harcerskiego batalionu AK „Zośka”, uczestnik powstania warszawskiego, kawaler Krzyża Walecznych (dwukrotnie).;C. Szefowie Głównej Kwatery „Pasieki”;;Batalionu AK „Zośka”, Warszawa, Polska;https://www.google.com/maps/place/?q=place_id:ChIJmVnJk2zLHkcRE3MbEo5LSiA;52.23449799999999,20.9442145
Plut. Wacław Antoni Wądołkowski ps. Pobóg (1925–1944) – członek Grup Szturmowych warszawskich Szarych Szeregów Hufca „Południe” (PD), uczestnik wielu akcji bojowych, m.in. akcji „Taśma” w Sieczychach koło Wyszkowa (grupa „Ubezpieczenie I”) i akcji „Zrzuty”, żołnierz harcerskiego batalionu AK „Zośka”, uczestnik powstania warszawskiego, kawaler Krzyża Walecznych.;C. Szefowie Głównej Kwatery „Pasieki”;;;NOT_FOUND;
Hm. dr Jan Wąsowicz ps. Tadeusz, Antoni, Brzechwa (1903–?) – hufcowy Hufca Męskiego w Tarnopolu (195–1926), komendant Lwowskiej Chorągwi Harcerzy (1926–1929), komendant Chorągwi Lwowskiej Szarych Szeregów Ul „Lew” (1943–1944), po II wojnie światowej inspektor jedwabnictwa i instruktor pszczelarstwa, zastępca dyrektora do spraw nauki w Państwowym Instytucie Jedwabiu Naturalnego w Milanówku (1951–1958), pracownik naukowy Szkoły Głównej Gospodarstwa Wiejskiego, kierownik Zakładu Owadów Użytkowych na Wydziale Zootechnicznym SGGW, współtwórca Zakładu Hodowli Owadów Użytkowych (1957), wiceprezes Zarządu Głównego i prezes Oddziału Warszawskiego Polskiego Towarzystwa Przyrodników im. Kopernika, kawaler Krzyża Walecznych.;C. Szefowie Głównej Kwatery „Pasieki”;;;NOT_FOUND;
Hm. mgr Stanisław Michał Wąsowicz ps. Staś, Sztoś (1901–1941) – hufcowy Hufca Harcerzy w Nowym Sączu (1932–1939), sędzia Sądu Okręgowego w Nowym Sączu (1934–1939), organizator pracy harcerzy z sądeckiej komórki Organizacji Orła Białego „Resurrectio”, współorganizator i członek Komendy Chorągwi Krakowskiej Szarych Szeregów Ul „Smok”, komendant Hufca Szarych Szeregów w Nowym Sączu, aktywny działacz sądeckiego Polskiego Czerwonego Krzyża i Rady Pomocy Żydom „Żegota”, więzień KL Auschwitz, brat prof. Józefa Wąsowicza i Tadeusza Wąsowicza „Bacy”.;C. Szefowie Głównej Kwatery „Pasieki”;;;NOT_FOUND;
Ppor. hm. Tadeusz Jerzy Wąsowicz ps. Baca (1906–1952) – członek Tajnej Organizacji Wojskowej „Związek Orła Białego” (1939), członek Komendy Chorągwi Krakowskiej Szarych Szeregów Ul „Smok” (1939–1941), jeden z najbliższych współpracowników komendanta hm. Seweryna Udzieli, więzień obozów koncentracyjnych w Oświęcimiu, Groß-Rosen oraz Buchenwaldzie, współzałożyciel i członek kierownictwa Grupy Harcerskiej „Droga Brzozowa” w KL Auschwitz, po II wojnie światowej pracownik PCK, dyrektor Stałej Ochrony byłego Obozu Oświęcimskiego (1946–1947), organizator i pierwszy dyrektor Państwowego Muzeum Auschwitz-Birkenau w Oświęcimiu (1947–1952), brat prof. Józefa Wąsowicza i Stanisława Wąsowicza „Stasia”, „Sztosia”.;C. Szefowie Głównej Kwatery „Pasieki”;;;NOT_FOUND;
Hm. Wacław Wdowiak ps. Las, Stanisław (1903–1976) – szef łączności Obwodu „Bażant” ZWZ-AK, komendant Hufca Grodzisk Mazowiecki Rój „Grochów”, organizator Szarych Szeregów na obszarze Milanówka i komendant Hufca Milanówek Rój „Milion”, kierownik akcji „M” w Chorągwi Mazowieckiej Szarych Szeregów Ul „Puszcza”, organizator i kierownik Tajnej Organizacji Nauczania na terenie Milanówka, po II wojnie światowej nauczyciel oraz członek Wojewódzkiego Komitetu Odbudowy Warszawy.;C. Szefowie Głównej Kwatery „Pasieki”;;;NOT_FOUND;
Phm. Stanisław Wdowicz ps. Borzęcki, Paweł, Litwin (1920–1946) – komendant Hufca Grup Szturmowych Szarych Szeregów w Kielcach oraz zastępca komendanta Kieleckiej Chorągwi Szarych Szeregów Ul „Skała” (1943–1945), redaktor konspiracyjnego pisma dla GS „Powstaniec”.;C. Szefowie Głównej Kwatery „Pasieki”;;;NOT_FOUND;
Por. phm. Jerzy Weil ps. Jerzyk, Jerzy, Jerzy Sadowy (1923–1944) – członek Grup Szturmowych warszawskich Szarych Szeregów Hufca „Południe” (PD), uczestnik wielu akcji bojowych, m.in. akcji „Taśma” w Sieczychach koło Wyszkowa (grupa „Ubezpieczenie I”) i akcji „Wilanów” (grupa „Streifa”), uczestnik powstania warszawskiego w harcerskim batalionie AK „Zośka”, kawaler Krzyża Srebrnego Orderu Virtuti Militari i Krzyża Walecznych.;C. Szefowie Głównej Kwatery „Pasieki”;;;NOT_FOUND;
Por. hm. Tadeusz Walenty Wesołowski (1903–2000) – harcerz 1 Poznańskiej Drużyny Skautowej im. Bolesława Chrobrego, powstaniec wielkopolski 1918–1919, uczestnik kampanii wrześniowej 1939 r. z 15 Pułkiem Ułanów Poznańskich w składzie Wielkopolskiej Brygady Kawalerii w ramach Armii „Poznań”, uczestnik bitwy nad Bzurą i obrony Warszawy, członek Szarych Szeregów Roju Poznań Chorągwi Wielkopolskiej Szarych Szeregów Ul „Przemysław”, żołnierz Armii Krajowej, po II wojnie światowej drużynowy 4 Poznańskiej Drużyny Harcerzy im. Władysława Jagiełły i komendant IV Hufca Harcerzy Poznań-Stare Miasto, członek Stowarzyszenia Szarych Szeregów.;C. Szefowie Głównej Kwatery „Pasieki”;;Osiedle Bolesława Chrobrego, 61-001 Poznań, Polska;https://www.google.com/maps/place/?q=place_id:ChIJo6xZfxVDBEcRY7JC-33ZhJ0;52.4493473,16.9140898
Kpr. pchor. Ryszard Wesoły ps. Rysiek (1921–1943) – członek Organizacji Małego Sabotażu „Wawer” oraz Grup Szturmowych warszawskich Szarych Szeregów Hufca „Wola” (WL), żołnierz harcerskiego batalionu AK „Zośka”, uczestnik wielu akcji bojowych, m.in. akcji pod Czarnocinem, gdzie poległ.;C. Szefowie Głównej Kwatery „Pasieki”;;Batalionu AK „Zośka”, Warszawa, Polska;https://www.google.com/maps/place/?q=place_id:ChIJmVnJk2zLHkcRE3MbEo5LSiA;52.23449799999999,20.9442145
