nazwa_obiektu;region;kategoria_obiektu;adres;maps_url;lokalizacja
Por. hm. Kazimierz Andrzej Gorzkowski ps. Andrzej, AS, Brzeszczot, Andrzej Gierałt, Godziemba, Andrzej Godziemba, Janusz, Piast, Kazimierz Pieracki, Andrzej Sokolnicki, Wolf, Andrzej Wolf, Żuliński (1899–1983) – przewodniczący Komisji Dyscyplinarnej i kierownik Wydziału Mniejszości Narodowych w Głównej Kwaterze Harcerzy (lata 30. XX w.), szef kolportażu prasy w Służbie Zwycięstwu Polski (1939), zastępca szefa Biura Informacji i Propagandy (BIP) Okręgu ZWZ Warszawa-Miasto i kierownik działu IV (akcje specjalne) Podwydziału „N” w BiP KG ZWZ-AK (1941), organizator i kierownik Organizacji Małego Sabotażu „Palmiry” (1940–1941), zastępca komendanta głównego Organizacji Małego Sabotażu „Wawer” – po połączeniu „Palmir” z „Wawrem” (1941–1944), uczestnik powstania warszawskiego, po II wojnie światowej pracownik Muzeum Narodowego w Warszawie, kawaler Krzyża Srebrnego Orderu Virtuti Militari i Krzyża Walecznych (czterokrotnie).;C. Szefowie Głównej Kwatery „Pasieki”;;;NOT_FOUND;
"Ppor. hm. dr med. Przemysław Mieczysław Górecki ps. Kuropatwa, Gozdal, Jerzy Wirski (1921–1997) – jeden ze współtwórców „Zawiszy” – najmłodszego pionu Szarych Szeregów, komendant Hufca Zawiszy Rój „Kresowe Stanice"" Chorągwi Warszawskiej Szarych Szeregów Ul „Wisła”, komendant zawiszackiej stanicy „Koszykowa” przy ul. Mokotowskiej 28, komendant „Zawiszy” w Głównej Kwaterze „Pasiece” (1942–1943), komendant służby pomocniczej „Mafeking” oraz koordynator szkolenia oddziałów „Zawiszaków” w ramach tej służby, jeden z głównych organizatorów i naczelnik oraz kierownik Oddziału Śródmieście Północ Harcerskiej Poczty Polowej przy ul. Świętokrzyskiej 28 i później przy pl. Napoleona Bonaparte (ob. pl. Powstańców Warszawy), po II wojnie światowej ukończył studia medyczne w Belgii i wyjechał do Afryki, organizator Centrum Chirurgicznego w Kongo, kierownik Katedry Medycyny Tropikalnej na Uniwersytecie Paryskim (1971), ekspert ONZ w zakresie chirurgii i chorób tropikalnych, kawaler Krzyża Srebrnego Orderu Virtuti Militari.";C. Szefowie Głównej Kwatery „Pasieki”;;Zawiszy, Warszawa, Polska;https://www.google.com/maps/place/?q=place_id:ChIJWc0KBXfLHkcRGW1k4PUzQ0w;52.2434157,20.9625769
Strz. Ryszard Aleksander Górecki ps. Majtek, Rysiek (1927–2012) – członek Bojowych Szkół Szarych Szeregów Hufca „Mokotów Górny” (MG) Chorągwi Warszawskiej Szarych Szeregów Ul „Wisła”, kolporter prasy podziemnej, organizator i wykonawca akcji megafonowej, uczestnik wielu akcji małego sabotażu oraz akcji „N” i akcji „Wieniec”, a także zdobywania broni na niemieckich żołnierzach w okolicach Dworca Głównego, żołnierz oddziału specjalnego Kedywu KG AK „Pegaz”, uczestnik powstania warszawskiego w harcerskim batalionie AK „Parasol”, po II wojnie światowej architekt, członek Stowarzyszenia Architektów Polskich (SARP) i Mazowieckiej Okręgowej Izby Architektów RP, autor książek wspomnieniowych z okresu okupacji niemieckiej: Przemoczone pod plecakiem osiemnaście lat oraz Epitafium żołnierzowi „Parasola”, kawaler Krzyża Walecznych.;C. Szefowie Głównej Kwatery „Pasieki”;;;NOT_FOUND;
Hm. Antoni Gregorkiewicz ps. Krokodyl, Zakliczewski (1902–1977) – nauczyciel i działacz żeglarski, hufcowy Hufca Harcerzy w Falenicy (1930–1938), pilot Mazowieckiej Chorągwi Harcerzy, komendant Centralnego Ośrodka Żeglarstwa Śródlądowego Głównej Kwatery Harcerzy w Niesłuczy nad jez. Narocz (1936–1939), hufcowy Hufca Szarych Szeregów Rój „Romb” w Rembertowie (1939–1940), komendant Okręgu Prawobrzeżnego Chorągwi Mazowieckiej Szarych Szeregów Ul „Puszcza” (1940–1942), po II wojnie światowej komendant Chorągwi „Kresowej” w Niemczech z siedzibą w Lubece (1946), członek Naczelnej Rady Harcerskiej poza granicami Kraju (1946), organizator i dyrektor pierwszej w Polsce Państwowej Szkoły Żeglugi Śródlądowej we Wrocławiu (1947–1953), pilot Dolnośląskiej Chorągwi Harcerzy (1947–1949) oraz Dolnośląskiej Chorągwi ZHP (1956–1963).;C. Szefowie Głównej Kwatery „Pasieki”;;;NOT_FOUND;
Kpt. inż.Bronisław Grun vel Bronisław Sztuna ps. Szyb, Rudy, Ginger, Rudy Anglik (1912–1989) – cichociemny przerzucony do Polski w ramach operacji lotniczej „Screwdriver” (1943), instruktor Szkoły Podchorążych Rezerwy Piechoty „Agricola”, zastępca dowódcy harcerskiego batalionu AK „Zośka”, uczestnik wielu akcji bojowych Grup Szturmowych Szarych Szeregów, m.in. akcji „Góral”, akcji pod Pogorzelą i Szymanowem (obserwator) oraz akcji likwidacyjnej „Polowanie” (dowódca akcji), a także akcji „Jula” pod Rogóżnem, po II wojnie światowej na emigracji w Wielkiej Brytanii, kawaler Krzyża Srebrnego Orderu Virtuti Militari i Krzyża Walecznych.;C. Szefowie Głównej Kwatery „Pasieki”;;;NOT_FOUND;
Ppor. phm. dr n. med. Jerzy Grundman ps. Jurras, Jur (1923–1984) – członek tajnej organizacji samokształceniowej PET („Przyszłość”) i Grup Szturmowych warszawskich Szarych Szeregów Hufca „Południe” (PD), uczestnik wielu akcji bojowych, m.in. akcji „Gołąb”, akcji „Taśma” w Sieczychach koło Wyszkowa (grupa „Ubezpieczenie I”) i akcji „Wilanów” (grupa „Streifa”) oraz akcji „Zrzuty” i akcji Lornetki”, a także jako zastępca dowódcy akcji „Jula” pod Tryńczą, uczestnik powstania warszawskiego, po II wojnie światowej pracownik naukowy w Instytucie Gruźlicy w Warszawie, kawaler Krzyża Srebrnego Orderu Virtuti Militari i Krzyża Walecznych (dwukrotnie).;C. Szefowie Głównej Kwatery „Pasieki”;;;NOT_FOUND;
Hm. dr Zbigniew Grządzielski ps. Mały (1932–2014) – członek Szarych Szeregów w Kamieńsku Hufca Radomszczańskiego Rój „Metal” Chorągwi Częstochowskiej Ul „Warta”, po II wojnie światowej nauczyciel i zastępca inspektora szkolnego w Częstochowie, pracownik naukowy i wykładowca Wyższej Szkoły Pedagogicznej, a później Akademii im. Jana Długosza w Częstochowie, członek Stowarzyszenia Szarych Szeregów Krąg Kamieńsk, instruktor harcerski, działacz PCK, członek Stowarzyszenia Autorów Polskich (1983–1987), wiceprezes Częstochowskiego Oddziału Polskiego Towarzystwa Historycznego (1971–1974), współautor publikacji Kamieńsk i jego harcerskie szeregi, autor Leksykonu miasta i gminy Kamieńsk oraz zbioru satyr pt. Myśli zwyczajne i niezwyczajne.;C. Szefowie Głównej Kwatery „Pasieki”;;;NOT_FOUND;
Hm. Zygmunt Feliks Grzelak ps. Józef, Boguś, Bogusz, Śledź (1912–2001) – drużynowy 20 Łódzkiej Drużyny Harcerzy im. Zawiszy Czarnego, uczestnik obrony Warszawy w szeregach IV batalionu 360 Pułku Piechoty Obrońców Warszawy, uczestnik Wojennego Pogotowia Harcerzy oraz organizator konspiracyjnego harcerstwa w Roju „Kominy” (Łódź) Łódzkiej Chorągwi Szarych Szeregów Ul „Kominy”, jeden z bliskich współpracowników hm. Aleksandra Kamińskiego „Kamyka”, kawaler Krzyża Walecznych.;C. Szefowie Głównej Kwatery „Pasieki”;;;NOT_FOUND;
Kpt. hm. Józef Andrzej Grzesiak ps. Czarny, Kmita, Mar (1900–1975) – członek Naczelnej Rady Harcerskiej (1929–1933), komendant Wileńskiej Chorągwi Harcerzy (1927–1933, 1935–1936), członek Głównej Kwatery Harcerzy (1936–1939), twórca i komendant Związku Bojowników Niepodległości (1939–1941), który w 1941 r. jako Szare Szeregi wszedł w skład Armii Krajowej, komendant Chorągwi Wileńskiej Szarych Szeregów Ul „Brama” (1941–1944), po II wojnie światowej członek Naczelnej Rady Harcerskiej i Głównej Kwatery Harcerstwa (1956–1958), komendant Gdańskiej Chorągwi Harcerstwa (1957–1958), kawaler Krzyża Walecznych (dwukrotnie).;C. Szefowie Głównej Kwatery „Pasieki”;;;NOT_FOUND;
Por. phm. Roman Grzybowski ps. Brzechwa, Fungus (1915–1994) – oficer wyszkolenia wojskowego Szarych Szeregów, instruktor i inspektor Szkoły Podchorążych Rezerwy Piechoty „Agricola”, oficer szkoleniowy i kwatermistrz harcerskiego batalionu AK „Zośka”, uczestnik powstania warszawskiego.;C. Szefowie Głównej Kwatery „Pasieki”;;Batalionu AK „Zośka”, Warszawa, Polska;https://www.google.com/maps/place/?q=place_id:ChIJmVnJk2zLHkcRE3MbEo5LSiA;52.23449799999999,20.9442145
"Kpt. inż. Tadeusz Roman Gubała ps. Tabaka, Ryś (1929) – członek „Zawiszaków” oraz Bojowych Szkół Hufca Wola Rój „Giermkowie Wolności"" Chorągwi Warszawskiej Szarych Szeregów Ul „Wisła”, uczestnik wielu akcji małego sabotażu, uczestnik powstania warszawskiego w 3. Rejonie Obwodu III „Waligóra” (Wola) Warszawskiego Okręgu AK, po II wojnie światowej na emigracji w USA, inżynier, wiceprezes Fundacji Armii Krajowej w Stanach Zjednoczonych, sekretarz oddziału Byłych Żołnierzy Armii Krajowej w Chicago.";C. Szefowie Głównej Kwatery „Pasieki”;;Zawiszaków, Warszawa, Polska;https://www.google.com/maps/place/?q=place_id:ChIJCSqPOPfRHkcRR6eh7QNqcGw;52.2597037,21.155964
Kpr. prof. zw. dr hab. inż. Witold Gutkowski ps. Vis (1928–2019) – członek Szarych Szeregów, drużynowy „OC-100” w Hufcu „Ochota” (OC) Chorągwi Warszawskiej Szarych Szeregów Ul „Wisła”, uczestnik wielu akcji bojowych Organizacji Małego Sabotażu „Wawer”, żołnierz batalionu AK „Chrobry I” i harcerskiego batalionu AK „Parasol”, uczestnik powstania warszawskiego, po II wojnie światowej członek Światowego Związku Żołnierzy Armii Krajowej, Związku Powstańców Warszawy oraz Stowarzyszenia Szarych Szeregów, zastępca dyrektora Instytutu Podstawowych Problemów Techniki PAN (1970–1972) i kierownik Zakładu Teorii Konstrukcji (1988–1998), członek rzeczywisty Polskiej Akademii Nauk (1991), członek i przewodniczący Komitetu Mechaniki PAN (1987–1995, 2007–2010), członek Europejskiej Akademii Nauk i American Association for the Advancement of Science, odznaczony Krzyżem Komandorskim Orderu Odrodzenia Polski (2010).;C. Szefowie Głównej Kwatery „Pasieki”;;;NOT_FOUND;
Phm. Jan Wacław Gutt ps. Nowicki, Janek, Kaczor Bojowy (1925–1943) – członek Organizacji Małego Sabotażu „Wawer” oraz instruktor w Bojowych Szkołach Hufca „Mokotów Górny” (MG) Chorągwi Warszawskiej Szarych Szeregów Ul „Wisła”, przewodził ekipie naklejającej afisze we Lwowie.;C. Szefowie Głównej Kwatery „Pasieki”;;;NOT_FOUND;
Hm. Stanisław Świętosław Gwizdalewicz ps. Tropiciel (1929–2015) – członek „Zawiszaków” i Bojowych Szkół Hufca „Praga” (PR) Chorągwi Warszawskiej Szarych Szeregów Ul „Wisła”, uczestnik powstania warszawskiego, po II wojnie światowej członek komendy, instruktor ds. turystyki i obozów Hufca Harcerzy Praga (1961), wieloletni członek władz Polskiego Stowarzyszenia Kulturalnego im. Józefa Bema na Węgrzech (1969–2015), współtwórca polsko-węgierskiej 513 Drużyny Harcerskiej im. gen. Józefa Bema na Węgrzech.;C. Szefowie Głównej Kwatery „Pasieki”;;;NOT_FOUND;
"Ppor. hm. mgr Bolesław Ignacy Haft-Szatyński ps. Olgierd, Bolek, Kwiek, Kolt, Korab (1923–2009) – komendant „Zawiszy” w Głównej Kwaterze Szarych Szeregów „Pasiece” (1943–1944), komendant Hufca Zawiszy Rój „Odra – Nysa"" oraz Bloku „Radiostacja” (Mokotów) Chorągwi Warszawskiej Szarych Szeregów Ul „Wisła” (1944), komendant służby pomocniczej „Mafeking” na Mokotowie, uczestnik wielu akcji małego sabotażu, uczestnik powstania warszawskiego, kierownik Oddziału Mokotów Harcerskiej Poczty Polowej (nadzór harcerski) przy ul. Tynieckiej 26 i później przy ul. bp. Ignacego Krasickiego 29, po II wojnie światowej pracował w handlu zagranicznym, przewodniczący Komisji „Zawiszy” przy Archiwum Państwowym m.st. Warszawy i Województwa Warszawskiego (1966–1969).";C. Szefowie Głównej Kwatery „Pasieki”;;;NOT_FOUND;
Hm. mgr Edward Heil ps. Jerzy, Krakowski, Scout, Stokłosa (1903–1944) – członek Komendy Hufca Harcerzy w Przemyślu (1932), komendant Poleskiej Chorągwi Harcerzy (1933–1935, 1938–1939), wicestarosta (1936–1939) oraz starosta brzeski (1939), organizator Harcerskiej Organizacji Niepodległościowo-Wojskowej we Lwowie, członek Sztabu Komendy Obszaru Wschodniego Szarych Szeregów, zastępca szefa Biura Informacji i Propagandy (BIP) przy Komendzie Okręgu AK w Krakowie (1940–1944), komendant Chorągwi Krakowskiej Szarych Szeregów Ul „Smok” (1943–1944).;C. Szefowie Głównej Kwatery „Pasieki”;;;NOT_FOUND;
Strz. Janusz Stanisław Heintze ps. Blady (1926) – członek Bojowych Szkół Hufca „Centrum Pragi” (CP) oraz Nowych Grup Szturmowych Bloku „Bazylika” (Praga) Chorągwi Warszawskiej Szarych Szeregów Ul „Wisła”, żołnierz Armii Krajowej, uczestnik powstania warszawskiego, brat Jerzego Heintze „Koko”.;C. Szefowie Głównej Kwatery „Pasieki”;;;NOT_FOUND;
Kpr. pchor. Jerzy Władysław Heintze ps. Koko (1921–1995) – członek Grup Szturmowych Hufca „Centrum Pragi” (CP) oraz Nowych Grup Szturmowych Bloku „Bazylika” (Praga) Chorągwi Warszawskiej Szarych Szeregów Ul „Wisła”, żołnierz Armii Krajowej, uczestnik powstania warszawskiego, po II wojnie światowej pracownik naukowy Akademii Sztuk Pięknych w Warszawie (1952–1966), redaktor graficzny wydawnictwa Nasza Księgarnia (1952–1989), członek Polskiego Towarzystwa Entomologicznego oraz Związku Polskich Artystów Plastyków i Stowarzyszenia Autorów ZAiKS, autor ilustracji do ponad dwustu pozycji książkowych, m.in. atlasu motyli „Pazie i rusałki” (1963) oraz ilustracji i tekstu do atlasu „Motyle Polski” (1978), brat Janusza Heintze „Bladego”.;C. Szefowie Głównej Kwatery „Pasieki”;;;NOT_FOUND;
Ppor. Bronisław Karol Hellwig ps. Bruno (1920–1945) – członek tajnej organizacji samokształceniowej PET („Przyszłość”) oraz Organizacji Małego Sabotażu „Wawer” i Grup Szturmowych warszawskich Szarych Szeregów Hufca „Centrum” (CR), żołnierz harcerskiego batalionu AK „Parasol”, szef służby motorowej oddziału (drużyna „Moto” 1. kompanii) – uznawany za jednego z najlepszych kierowców bojowych Armii Krajowej, uczestnik wielu akcji bojowych, m.in. akcji dywersyjnej pod Płochocinem, akcji likwidacyjnych: „Hergel”, „Braun”, „Kutschera” i „Stamm” oraz akcji odbicia ze szpitala Jana Bożego żołnierza „Parasola” Benedykta Sylwestrowicza „Asa”, uczestnik powstania warszawskiego, kawaler Krzyża Srebrnego Orderu Virtuti Militari i Orderu Krzyża Grunwaldu III klasy oraz Krzyża Walecznych.;C. Szefowie Głównej Kwatery „Pasieki”;;Batalionu AK „Parasol”, Warszawa, Polska;https://www.google.com/maps/place/?q=place_id:ChIJ1WRJQW3LHkcRgvv7eTLSRiI;52.2376164,20.9454144
Mjr hm. Julian Antoni Hendler ps. Czarny (1907–2008) – członek Komendy Hufca Harcerzy w Ostrowcu Świętokrzyskim (1938–1939), komendant Pogotowia Wojennego Harcerzy w Ostrowcu Świętokrzyskim, organizator Bojowych Szkół (BS) Roju Ostrowiec Świętokrzyski Kieleckiej Chorągwi Szarych Szeregów Ul „Skała”, żołnierz Związku Walki Zbrojnej (ZWZ) i Armii Krajowej (AK), po II wojnie światowej kierownik Wydziału Gospodarczego Kieleckiej Chorągwi Harcerzy (1946–1947) oraz Wydziału Organizacyjnego Komendy Kieleckiej Chorągwi Harcerstwa (1956), członek Komisji Historycznej Chorągwi Kieleckiej ZHP i Hufca Kielce-Miasto im. Obrońców Westerplatte, honorowy przewodniczący Rady Kręgów Instruktorskich „Łysica”.;C. Szefowie Głównej Kwatery „Pasieki”;;;NOT_FOUND;
Kpr. Andrzej Antoni Heppen vel Stanisław Waligórski ps. Stasiek, Waligóra (1926–2012) – członek Szarych Szeregów, zastępca komendanta „Zawiszy” Bloku „Zamek” (Śródmieście) Chorągwi Warszawskiej Szarych Szeregów Ul „Wisła”, uczestnik wielu akcji małego sabotażu, łącznik służby pomocniczej „Mafeking” i listonosz Oddziału Śródmieście Południe Harcerskiej Poczty Polowej, żołnierz Armii Krajowej w batalionie im. Jana Kilińskiego, uczestnik powstania warszawskiego.;C. Szefowie Głównej Kwatery „Pasieki”;;;NOT_FOUND;
Hm. Brunon Hlebowicz vel Jan Chreptowicz ps. Znachor, Brunek (1908–2001) – nauczyciel w szkole powszechnej w Grodnie (1930–1939), inspektor oświaty pozaszkolnej z ramienia ZHP (1939–1941), organizator tajnego szkolnictwa podstawowego i średniego w Grodnie (1941–1944), członek Szarych Szeregów Roju „Niemen” (Grodno) Białostockiej Chorągwi Szarych Szeregów Ul „Żubr”.;C. Szefowie Głównej Kwatery „Pasieki”;;;NOT_FOUND;
Kpr. pchor. Henryk Apolinary Hoffmann ps. Sęp (1925–1944) – harcerz 22 Warszawskiej Drużyny Harcerzy im. Władysława Łokietka na Grochowie, członek Bojowych Szkół i Grup Szturmowych warszawskich Szarych Szeregów Hufca „Praga” (PR) oraz Nowych Grup Szturmowych Szarych Szeregów Bloku „Bazylika” (Praga), żołnierz harcerskiego batalionu AK „Zośka”, uczestnik powstania warszawskiego.;C. Szefowie Głównej Kwatery „Pasieki”;;;NOT_FOUND;
Kpr. Jerzy Horczak ps. Wróbel (1927–1943) – członek Organizacji Małego Sabotażu „Wawer” oraz jeden z najmłodszych żołnierzy Grup Szturmowych Szarych Szeregów, uczestnik akcji „Meksyk IV”, magazynier broni Hufca Południe (PD) w wilii przy ul. Różanej 36 w Warszawie, kawaler Orderu Virtuti Militari, jeden z bohaterów książki Aleksandra Kamińskiego Kamienie na szaniec (1943) i książki Juliusza Bogdana Deczkowskiego „Wróbel” z „Kamieni na szaniec”. Wspomnienie o przyjacielu (1992) oraz filmu dokumentalnego „Oni szli Szarymi Szeregami” (2010).;C. Szefowie Głównej Kwatery „Pasieki”;;;NOT_FOUND;
Plut. pchor. Henryk Humięcki ps. Olbrzym, Olbrzymek (1920–1944) ) – członek tajnej organizacji samokształceniowej PET („Przyszłość”) i Grup Szturmowych warszawskich Szarych Szeregów Hufca „Centrum” (CR), żołnierz oddziału specjalnego Kedywu KG AK „Agat”, uczestnik wielu akcji małego sabotażu oraz akcji likwidacyjnej „Kutschera”, kawaler Krzyża Walecznych.;C. Szefowie Głównej Kwatery „Pasieki”;;;NOT_FOUND;
"Kpr. pchor. Stanisław Huskowski ps. Ali (1922–1944) – członek tajnej organizacji samokształceniowej PET („Przyszłość”) oraz Grup Szturmowych warszawskich Szarych Szeregów Hufca „Centrum” (CR), żołnierz oddziału specjalnego Kedywu KG AK „Agat” i harcerskiego batalionu AK „Parasol”, uczestnik akcji małego sabotażu, m.in. współorganizator i wykonawca akcji megafonowej oraz uczestnik wielu akcji bojowych, m.in. akcji dywersyjnej pod Płochocinem, jako zastępca dowódcy akcji likwidacyjnych: „Kutschera"" i „Koppe”, a także ewakuacji rannych ze Szpitala Przemienienia Pańskiego (dowódca grupy przeniesienia rannych) w ramach likwidacji skutków akcji „Kutschera”, brat Tadeusza Huskowskiego „Tadeusza”.";C. Szefowie Głównej Kwatery „Pasieki”;;;NOT_FOUND;
Por. phm. dr Tadeusz Huskowski ps. Tadeusz, Tadzio Żoliborski (1924–1984) – członek tajnej organizacji samokształceniowej PET („Przyszłość”) oraz Organizacji Małego Sabotażu „Wawer” i Grup Szturmowych warszawskich Szarych Szeregów Hufca „Centrum” (CR), żołnierz oddziału specjalnego Kedywu KG AK „Agat” i harcerskiego batalionu AK „Zośka”, uczestnik akcji małego sabotażu, m.in. współorganizator i wykonawca akcji megafonowej, uczestnik powstania warszawskiego w Zgrupowaniu „Żniwiarz” Obwodu II „Żywiciel” (Żoliborz) Warszawskiego Okręgu AK, po II wojnie światowej pracownik naukowo-dydaktyczny Politechniki Wrocławskiej, kawaler Krzyża Srebrnego Orderu Virtuti Militari i Krzyża Walecznych (dwukrotnie), pośmiertnie odznaczony Krzyżem Komandorskim z Gwiazdą Orderu Odrodzenia Polski (2009), brat Stanisława Huskowskiego „Alego”.;C. Szefowie Głównej Kwatery „Pasieki”;;;NOT_FOUND;
Mjr inż. Michał Issajewicz ps. Miś (1921–2012) – żołnierz Związku Walki Zbrojnej (ZWZ) i Armii Krajowej (AK) oraz oddziału specjalnego Kedywu KG AK „Agat” – „Pegaz” i harcerskiego batalionu AK „Parasol”, uczestnik akcji likwidacyjnej „Kutschera” (kierowca i trzeci wykonawca wyroku), więzień obozu koncentracyjnego Stutthof, po II wojnie światowej inżynier budownictwa lądowego i główny specjalista w Centrali Handlu Zagranicznego, członek Ogólnopolskiego Komitetu Frontu Jedności Narodu (1958), wiceprezes Rady Naczelnej (1972-1974) i członek Prezydium Rady Naczelnej Związku Bojowników o Wolność i Demokrację (1974–1979), wychowawca warszawskiej młodzieży, kawaler Krzyża Srebrnego Orderu Virtuti Militari i Orderu Krzyża Grunwaldu III klasy oraz Krzyża Walecznych (dwukrotnie).;C. Szefowie Głównej Kwatery „Pasieki”;;;NOT_FOUND;
Mjr Alfons Jabłoński vel Stanisław Pawluk ps. Alf, Radca, Inżynier, Apis (1899–1946) – członek Szarych Szeregów, żołnierz Związku Walki Zbrojnej (ZWZ) i Armii Krajowej (AK), dowódca Odwodowego Batalionu Harcerskiego (Obwód Warszawa-Śródmieście), instruktor wyszkolenia wojskowego w Chorągwi Warszawskiej Szarych Szeregów Ul „Wisła”, komendant Szkoły Podchorążych Rezerwy Piechoty „Agricola”, komendant Obwodu Gródek Jagielloński Inspektoratu Zachodniego Okręgu Lwów AK, szef Wydziału Operacyjnego Komendy Okręgu Lwów AK, instruktor Szarych Szeregów we Lwowie, szef sztabu Okręgu Lwów „Nie”, po II wojnie światowej działacz podziemia antykomunistycznego, kierownik Wydziału Organizacyjnego Komendy Okręgu Jelenia Góra „Zachód” Zrzeszenia Wolność i Niezawisłość (WiN), zastępca komendanta i następnie p.o. komendanta Okręgu Jelenia Góra WiN.;C. Szefowie Głównej Kwatery „Pasieki”;;;NOT_FOUND;
Mjr hm. Jerzy Stefan Jabrzemski ps. Wojtek, Słomczyński, Kobuz Czarny (1918–2013) – dziennikarz sportowy (1937–1939, 1946–1978), członek Głównej Kwatery Szarych Szeregów „Pasieki” (1943–1944), wizytator dla chorągwi: kieleckiej Ul „Skała”, lubelskiej Ul „Zboże” i radomskiej Ul „Rady”, organizator i szef akcji „N” – wydawnictw dywersyjnych w języku niemieckim (1941–1943), kierownik Wydziału Wydawnictw Głównej Kwatery „Pasieki”, wydawca prasy harcerskiej, redaktor naczelny konspiracyjnych czasopism „Brzask” i „Bądź gotów”, komendant Bloku „Zamek” (Śródmieście) Chorągwi Warszawskiej Szarych Szeregów Ul „Wisła” (1944) i p.o. komendanta Chorągwi Warszawskiej w czasie powstania warszawskiego, po II wojnie światowej autor książek o konspiracyjnym harcerstwie: Szare Szeregi. Harcerze 1939–1945 [red.] tom I–III (1988) i Harcerze z Szarych Szeregów (1997), współorganizator i honorowy przewodniczący Stowarzyszenia Szarych Szeregów, członek Rady Muzeum Harcerstwa w Warszawie (2001–2013), odznaczony Krzyżem Komandorskim Orderu Odrodzenia Polski (2011).;C. Szefowie Głównej Kwatery „Pasieki”;;;NOT_FOUND;
Ppor. hm. prof. zw. dr inż. Jerzy Jaczewski ps. Grot, Wilk, Traper, Bryza, Kazimierz Bury (1918–2000) – hufcowy Hufca Praga (PR), komendant Okręgu Praga Chorągwi Warszawskiej Szarych Szeregów Ul „Wisła” (1941–1942), komendant Bloku „Bazylika” (Praga), członek Głównej Kwatery Szarych Szeregów „Pasieki”, kierownik Służby Wywiadu i Informacji Szarych Szeregów, uczestnik powstania warszawskiego, po II wojnie światowej wykładowca akademicki i pracownik naukowy Politechniki Gdańskiej, członek Gdańskiego Towarzystwa Naukowego i Polskiego Komitetu Pomiarów i Automatyki oraz Sekcji Energoelektroniki i Napędu Elektrycznego Komitetu Elektrotechniki PAN.;C. Szefowie Głównej Kwatery „Pasieki”;;;NOT_FOUND;
Aleksander Jadach ps. Olek (1926–1998) – członek Organizacji Małego Sabotażu „Wawer” oraz Grup Szturmowych warszawskich Szarych Szeregów Hufca „Południe” (PD), uczestnik wielu akcji bojowych, m.in. akcji „Taśma” w Sieczychach koło Wyszkowa (pierwsza grupa „Atak II”), żołnierz harcerskiego batalionu AK „Zośka”.;C. Szefowie Głównej Kwatery „Pasieki”;;;NOT_FOUND;
Por. hm. Jerzy Jagiełło ps. Florian (1923–1944) – członek Grup Szturmowych warszawskich Szarych Szeregów Hufca „Południe” (PD), uczestnik wielu akcji bojowych, m.in. akcji „Taśma” w Sieczychach koło Wyszkowa (dowódca trzeciej grupy „Atak II”) i akcji „Wilanów” (grupa „Streifa”) oraz jako dowódca akcji „Jula” pod Tryńczą, a także jako obserwator w akcji „TU” (Tłuszcz-Urle), kawaler Krzyża Srebrnego Orderu Virtuti Militari i Krzyża Walecznych (dwukrotnie).;C. Szefowie Głównej Kwatery „Pasieki”;;;NOT_FOUND;
Inż. Andrzej Jakubowski ps. Kim (1928) – członek Szarych Szeregów, łącznik i listonosz Oddziału Śródmieście Północ Harcerskiej Poczty Polowej w powstaniu warszawskim, po II wojnie światowej zamieszkał we Wrocławiu, ukończył Politechnikę Wrocławską i do emerytury pracował jako inżynier.;C. Szefowie Głównej Kwatery „Pasieki”;;;NOT_FOUND;
Hm. Józef Jakubowski ps. Ryś, Ziutek (1903–1975) – nauczyciel, organizator konspiracyjnego harcerstwa na Podlasiu, komendant Hufca Biała Podlaska Chorągwi Mazowieckiej Szarych Szeregów Ul „Puszcza”, organizator Harcerskiej Poczty Leśnej w Białej Podlaskiej, oficer wywiadu Armii Krajowej.;C. Szefowie Głównej Kwatery „Pasieki”;;;NOT_FOUND;
